{
  "_schema_version": "1.0",
  "playlist_id": "pl_xyz789",
  "version_hash": "sha256:newHashHere",
  "source": "server",
  "created_at": "2026-07-09T12:00:00Z",
  "download_status": {
    "total_tracks": 50,
    "downloaded_tracks": 47,
    "verified_tracks": 47,
    "validated_track_ids": ["track_001"],
    "failed_tracks": [],
    "progress_percent": 94,
    "started_at": "2026-07-09T12:00:00Z"
  },
  "tracks": [
    {
      "id": "track_001",
      "url": "/music/track001.mp3",
      "filename": "track001.mp3",
      "sha256": "e3b0c44298fc1c149afbf4c8996fb92427ae41e4649b934ca495991b7852b855",
      "size_bytes": 1048576,
      "duration_seconds": 180,
      "title": "Canción 1"
    }
  ]
}
